{
  "schema_version": "2.0",
  "generated_at": "2026-07-27",
  "source": "majors.json",
  "programs": [
    {
      "id": "anthropologycultural",
      "name": "Anthropology, Cultural",
      "requirements": [
        {
          "label": "Major in Cultural Anthropology",
          "sections": [
            {
              "heading": "Anthropology courses",
              "items": [
                {
                  "type": "course",
                  "code": "ANTH 162"
                },
                {
                  "type": "course",
                  "code": "ANTH 325"
                },
                {
                  "type": "course",
                  "code": "ANTH 424"
                },
                {
                  "type": "any_of",
                  "codes": [
                    "ANTH 461",
                    "ANTH 471"
                  ],
                  "note": "Culminating experience"
                },
                {
                  "type": "electives",
                  "count": 6,
                  "constraints": [
                    {
                      "type": "discipline",
                      "prefixes": [
                        "ANTH"
                      ]
                    },
                    {
                      "type": "min_from",
                      "codes": [
                        "ANTH 223",
                        "ANTH 233",
                        "ANTH 238",
                        "ANTH 242",
                        "ANTH 243"
                      ],
                      "atLeast": 2,
                      "note": "geographical area courses"
                    },
                    {
                      "type": "min_from",
                      "codes": [
                        "ANTH 259",
                        "ANTH 311",
                        "ANTH 316",
                        "ANTH 332",
                        "ANTH 333",
                        "ANTH 334",
                        "ANTH 336"
                      ],
                      "atLeast": 2,
                      "note": "comparative topics courses"
                    }
                  ]
                }
              ]
            }
          ]
        },
        {
          "label": "Minor",
          "sections": [
            {
              "heading": "Anthropology courses",
              "items": [
                {
                  "type": "course",
                  "code": "ANTH 162"
                },
                {
                  "type": "any_of",
                  "codes": [
                    "ANTH 222",
                    "ANTH 325",
                    "ANTH 424"
                  ]
                },
                {
                  "type": "electives",
                  "count": 3,
                  "constraints": [
                    {
                      "type": "discipline",
                      "prefixes": [
                        "ANTH"
                      ]
                    },
                    {
                      "type": "min_from",
                      "codes": [
                        "ANTH 259",
                        "ANTH 311",
                        "ANTH 316",
                        "ANTH 332",
                        "ANTH 333",
                        "ANTH 334",
                        "ANTH 336"
                      ],
                      "atLeast": 1,
                      "note": "comparative topics course"
                    },
                    {
                      "type": "min_from",
                      "codes": [
                        "ANTH 223",
                        "ANTH 233",
                        "ANTH 238",
                        "ANTH 242",
                        "ANTH 243"
                      ],
                      "atLeast": 1,
                      "note": "geographical area course"
                    }
                  ]
                }
              ]
            }
          ]
        }
      ]
    },
    {
      "id": "archaeology",
      "name": "Archaeology",
      "requirements": [
        {
          "label": "Minor",
          "sections": [
            {
              "heading": "Required courses",
              "items": [
                {
                  "type": "course",
                  "code": "CLA 228"
                },
                {
                  "type": "any_of",
                  "codes": [
                    "GEO 161",
                    "GEO 162"
                  ]
                },
                {
                  "type": "course",
                  "code": "ANTH 162"
                },
                {
                  "type": "electives",
                  "count": 2,
                  "constraints": [
                    {
                      "type": "level",
                      "level": 300,
                      "atLeast": 1
                    }
                  ]
                }
              ]
            }
          ]
        }
      ]
    },
    {
      "id": "artanddesign",
      "name": "Art and Design",
      "requirements": [
        {
          "label": "Major",
          "sections": [
            {
              "heading": "",
              "items": [
                {
                  "type": "course",
                  "code": "ARTD 126"
                },
                {
                  "type": "course",
                  "code": "ARTD 171"
                },
                {
                  "type": "course",
                  "code": "ARTD 172"
                },
                {
                  "type": "electives",
                  "count": 3,
                  "constraints": [
                    {
                      "type": "from",
                      "note": "a 3-course sequence in one of: ceramics, graphic design, illustration, painting, photography, printmaking, drawing, or sculpture"
                    }
                  ]
                },
                {
                  "type": "course",
                  "code": "ARTD 402"
                },
                {
                  "type": "course",
                  "code": "ARTD 471",
                  "note": "Culminating experience"
                },
                {
                  "type": "electives",
                  "count": 3,
                  "constraints": [
                    {
                      "type": "discipline",
                      "prefixes": [
                        "ARTD"
                      ]
                    }
                  ]
                }
              ]
            },
            {
              "heading": "Two Art History courses",
              "items": [
                {
                  "type": "any_of",
                  "codes": [
                    "ARTH 112",
                    "ARTH 328",
                    "ARTH 339",
                    "ARTH 343",
                    "ARTH 344",
                    "ARTH 345"
                  ]
                },
                {
                  "type": "any_of",
                  "codes": [
                    "ARTH 111",
                    "ARTH 210",
                    "ARTH 212"
                  ],
                  "note": "or others by petition"
                }
              ]
            }
          ]
        }
      ]
    },
    {
      "id": "arthistory",
      "name": "Art History",
      "requirements": [
        {
          "label": "Major",
          "sections": [
            {
              "heading": "Eight Art History courses",
              "items": [
                {
                  "type": "course",
                  "code": "ARTH 111"
                },
                {
                  "type": "course",
                  "code": "ARTH 112"
                },
                {
                  "type": "course",
                  "code": "ARTH 362"
                },
                {
                  "type": "electives",
                  "count": 4,
                  "constraints": [
                    {
                      "type": "from",
                      "codes": [
                        "ARTH 171",
                        "ARTH 210",
                        "ARTH 212",
                        "ARTH 213",
                        "ARTH 214",
                        "ARTH 223",
                        "ARTH 225",
                        "ARTH 328",
                        "ARTH 335",
                        "ARTH 339",
                        "ARTH 343",
                        "ARTH 344",
                        "ARTH 345",
                        "ARTH 348"
                      ]
                    }
                  ]
                },
                {
                  "type": "any_of",
                  "codes": [
                    "ARTH 457",
                    "ARTH 471"
                  ],
                  "note": "Culminating experience"
                }
              ]
            },
            {
              "heading": "",
              "items": [
                {
                  "type": "electives",
                  "count": 1,
                  "constraints": [
                    {
                      "type": "discipline",
                      "prefixes": [
                        "ARTD",
                        "ARTH"
                      ]
                    }
                  ]
                }
              ]
            }
          ]
        },
        {
          "label": "Minor",
          "sections": [
            {
              "heading": "",
              "items": [
                {
                  "type": "course",
                  "code": "ARTH 112"
                },
                {
                  "type": "electives",
                  "count": 4,
                  "constraints": [
                    {
                      "type": "discipline",
                      "prefixes": [